{
  "$schema": "../../schema/incident.schema.json",
  "protocol": "RoulettePotV2",
  "name": "RoulettePotV2 swapProfitFees sizes the LINK top-up from a spot quote",
  "summary": "RoulettePotV2.swapProfitFees is public and sizes each casino's LINK top-up with router.getAmountsIn over the LINK/WBNB pair's spot reserves, taking the shortfall from casino liquidity, then buys LINK with no minimum output. The attacker flash-borrowed 4,204 WBNB, bought 17,528 LINK out of the pair to inflate LINK's price, called swapProfitFees so the pot sold its casinos' tokens and spent 43.09 BNB on 21.27 LINK, then sold the LINK back into the pair.",
  "targets": [
    {
      "address": "0xf573748637e0576387289f1914627d716927f90f",
      "reset": {
        "kind": "deployment",
        "tx": "0x50313f3be0eb81268f35a71521a54ff01331a6f960887a0453698854f8be02cb"
      }
    }
  ],
  "loss": {
    "usd": 29908.14,
    "assets": [
      {
        "symbol": "BNB",
        "amount": "4.171603472025223867",
        "usd": 2895.22
      },
      {
        "token": "0x4d9927a8dc4432b93445da94e4084d292438931f",
        "symbol": "BNBP",
        "amount": "324850.208759244488266486",
        "usd": 26230.72
      },
      {
        "token": "0x0e09fabb73bd3ade0a17ecc321fd13a19e81ce82",
        "symbol": "CAKE",
        "amount": "325.721336343852503289",
        "usd": 752.42
      },
      {
        "token": "0x2ab0e9e4ee70fff1fb9d67031e44f6410170d00e",
        "symbol": "bXEN",
        "amount": "28942218253.71429230333588591",
        "usd": 20.34
      },
      {
        "token": "0xe9e7cea3dedca5984780bafc599bd69add087d56",
        "symbol": "BUSD",
        "amount": "9.442741234770661142",
        "usd": 9.44
      }
    ]
  },
  "refs": [
    "https://github.com/SunWeb3Sec/DeFiHackLabs/blob/ad353ba25fbb897c56d64c28ce92ee10ac68cad2/src/test/2025-01/RoulettePotV2_exp.sol"
  ],
  "notes": [
    "Casinos are created through the casino NFT contract and only carry liquidity; no owner setting after deployment made swapProfitFees exploitable, so the deployment is the reset.",
    "No earlier exploit: of the 19 earlier swapProfitFees runs (SuppliedLink/SuppliedBNBP events since deployment), 17 were sent by the deployer and two by other accounts (one through Multicall3), each buying LINK at the market price; none followed the anchor.",
    "Loss is the pot's depletion: BNBP has no DefiLlama price and is valued at the 37.79 BNB its in-transaction sale returned, at market before the LINK purchase; the 21.27 LINK went to the protocol's VRF subscription and is not subtracted."
  ]
}
