{
  "$schema": "../../schema/incident.schema.json",
  "protocol": "Goldfinch",
  "name": "Goldfinch legacy Pool unauthenticated collectInterestRepayment",
  "summary": "The deprecated Goldfinch V1 Pool's collectInterestRepayment(from, amount) had no caller check: it pulls USDC from any address that approved the pool and adds it to the share price. The attacker flash-borrowed USDC, bought nearly all pool shares, pulled a stale approver's USDC in and withdrew the inflated shares; a copycat took the rest.",
  "targets": [
    {
      "address": "0x0689aa2234d06ac0d04cdac874331d287afa4b43",
      "code": "0x7dbe30fde1eca6856806ff14fc456ec6791c73fe",
      "reset": {
        "kind": "config",
        "tx": "0xb16bd39e08c5f36bc9a64ab444756d07b9829ba9f9e0d83a3566cbcfdaa32303",
        "address": "0x0689aa2234d06ac0d04cdac874331d287afa4b43",
        "slot": "0xcf"
      }
    }
  ],
  "loss": {
    "usd": 350064.69,
    "assets": [
      {
        "token": "0xa0b86991c6218b36c1d19d4a2e9eb0ce3606eb48",
        "symbol": "USDC",
        "amount": "350137.004224",
        "usd": 350064.69
      }
    ]
  },
  "campaign": [
    "eip155:1:0xd462ce892166e041f303af47340ae50d22b3cadc55be65cecbfcab8f5d48e149"
  ],
  "refs": [
    "https://x.com/PeckShieldAlert/status/1995774198564966434",
    "https://www.cryptopolitan.com/goldfinch-finance-user-deltatiger-eth-hacked/",
    "eip155:1:0xe2c2d3b16d493431ae6312e3a7be724b458e4444cebe8860d0370e36b0e49389"
  ],
  "notes": [
    "Reset is setTotalFundsLimit raising the pool cap from 0, the last setting the exploit needed: deposit() requires poolWithinLimit, so no shares could be bought before it. The two later ProxyImplementationUpdated events re-set the same implementation and change no code.",
    "Loss is gross per transaction (rule 14): the approver's USDC in the anchor plus the USDC the copycat took from the pool, most of which the anchor had stranded there. The 1,000 and 10,000 USDC deposits were flash-borrowed and withdrawn in the same transactions."
  ]
}
