{
  "$schema": "../../schema/incident.schema.json",
  "protocol": "Bankroll Network",
  "name": "Bankroll Stack drip pays a same-transaction buyer for the whole idle period",
  "summary": "The BankrollNetworkStack template's distribute() credits stakers 2% of dividendBalance_ per day for all the time since lastPayout, without capping it at the pool, and buy() mints the buyer's stake before calling it. The Ethereum StackPlus LINK pool had been idle for 289 days, so the attacker flash-bought a dominant stake, which the first distribution credited 5.8 times the drip pool, then sold and withdrew; buyFor() pulls from six wallets with standing LINK approvals supplied the LINK paid out.",
  "targets": [
    {
      "address": "0x7b3611b0affc27d212a68293831d3b55354b802f",
      "reset": {
        "kind": "deployment",
        "tx": "0x8d9062ee603843adefcec8529ef064f36d124d844ebcff57a9ffa8e8e0c51dfc"
      }
    }
  ],
  "campaign": [
    "eip155:56:0x0706425beba4b3f28d5a8af8be26287aa412d076828ec73d8003445c087af5fd",
    "eip155:56:0x61191f526a4d03642a93be04ecf57abdf945feacc30d13c99235fc3045934a55",
    "eip155:56:0x9054bf1f363f8627f8a3fa2d3ef3fb358510cd6155532c4606d102d8ed957bc0",
    "eip155:56:0x7226b3947c7e8651982e5bd777bca52d03ea31d19b515dec123595a4435ae22c",
    "eip155:56:0x96a6a5ded6d652ec8a38804281fd99437f4cb3fcb4858ca0cf6c632eb34a40c4",
    "eip155:56:0x8b8e655c0ab0cd400e23e6d6a935aa23226a8a060bb37f40663f2d81ee63b94f",
    "eip155:56:0x56a41f5ecf9bc574d5885be00da86f37ce18fcee823bef636306cf579475f30f",
    "eip155:56:0x853f8dd4db510692e157718caea7d5b8a5e265d0f177a9249693badb9c8a97bd",
    "eip155:56:0xbba801984f622dafd07e968a700c958cf3a2dfef66ab5b0784e551b3819fae78",
    "eip155:1:0x3cacf4bbcb5e56e859ca8ba9e925041e9aca3e86354e9280c7cb09602fab9e8b",
    "eip155:56:0x8db69c64eaa8bc36d489dc03d4cb5707d910b5dd8f0efeaeeb4af27537f1913d",
    "eip155:56:0xa92c5e2dc4c9ef437bde5a7128f0040537cdd5cf9052ca75aa8b0bb3266bc3e2",
    "eip155:56:0x9201eda6c7639dcf5525d05fcc25de5082386141a64b89a52e999866711835a6",
    "eip155:1:0x8d3bc289f9fcdd9a1fadad8a3453907ac3753a7c0b7bee201968d118df71d19f",
    "eip155:56:0x5382925aeeeef808cfb95a8aa05ca982fe05ccb8adbdddf3eecc15f962754692",
    "eip155:56:0x0f5740cddedefb6dd34596b5099647a72069f90b61becfb9b42484fe5a7f87ee",
    "eip155:56:0x351cfaccf364be30675212dcf40b531b84faf52b3d6222ee1d320363c406a4a0",
    "eip155:1:0x0ad2add184b1ac3d03067b943e56511a5e2802721f84a33af0611728023e728a",
    "eip155:56:0x4ad706c73292c1d5e962f4060e10219ab2a5a493c431302289eab9b9f5dc167c",
    "eip155:56:0x27a15982be75353cb75ee9e767451ccb042d0aa072d9f9487a7eb45e6c030939",
    "eip155:56:0xce556812900338b1c5b1dc5329a56e162b166c0cfa44c1b835f25d6d0b4ab919",
    "eip155:137:0x85a386d68e82c3470164b03b6a71d6d120e973645ab22a4f7655e462db54c638"
  ],
  "loss": {
    "usd": 102386.96,
    "assets": [
      {
        "chainId": 56,
        "token": "0xe9e7cea3dedca5984780bafc599bd69add087d56",
        "symbol": "BUSD",
        "amount": "42716.763446936329936272",
        "usd": 42702.21
      },
      {
        "chainId": 56,
        "symbol": "BNB",
        "amount": "29.786528993752124174",
        "usd": 19228.1
      },
      {
        "token": "0x514910771af9ca656af840dff83e8264ecf986ca",
        "symbol": "LINK",
        "amount": "975.522856235782422496",
        "usd": 12779.63
      },
      {
        "chainId": 56,
        "token": "0x7130d2a12b9bcbfae4f2634d864a1ee1ce3ead9c",
        "symbol": "BTCB",
        "amount": "0.122465557090730843",
        "usd": 9961.8
      },
      {
        "chainId": 56,
        "token": "0x2170ed0880ac9a755fd29b2688956bd959f933f8",
        "symbol": "ETH",
        "amount": "2.160062128127888822",
        "usd": 9269.6
      },
      {
        "token": "0x6b785a0322126826d8226d77e173d75dafb84d11",
        "symbol": "VLT",
        "amount": "5464.976178373558210266",
        "usd": 1643.88
      },
      {
        "chainId": 56,
        "token": "0x0e09fabb73bd3ade0a17ecc321fd13a19e81ce82",
        "symbol": "Cake",
        "amount": "315.371272064256851334",
        "usd": 680.64
      },
      {
        "chainId": 56,
        "token": "0x190b589cf9fb8ddeabbfeae36a813ffb2a702454",
        "symbol": "BDO",
        "amount": "142740.889397811999633044",
        "usd": 599.61
      },
      {
        "token": "0x0d8775f648430679a709e98d2b0cb6250d2887ef",
        "symbol": "BAT",
        "amount": "196.229461642488682776",
        "usd": 23.79
      },
      {
        "chainId": 56,
        "token": "0xa8a1a8d65d08cb95b611e340c16464f7bb9b75b8",
        "symbol": "Drip",
        "amount": "14099.368784902609195049",
        "usd": 4446.37
      },
      {
        "chainId": 56,
        "token": "0xe2a6428fd332287b0470965e16350d3cc1736e3e",
        "symbol": "ZOMBIE",
        "amount": "509847.16369155",
        "usd": 798.98
      },
      {
        "chainId": 56,
        "token": "0xf83849122f769a0a7386df183e633607c890f6c0",
        "symbol": "ABS",
        "amount": "129844.832445456995523711",
        "usd": 168.88
      },
      {
        "chainId": 56,
        "token": "0x544be21b097d99c739d027ed42edef6a0a98ee2a",
        "symbol": "SIN",
        "amount": "202913804.52370899",
        "usd": 66.9
      },
      {
        "chainId": 56,
        "token": "0x4227c55bf21e95a87c00988fec98c50e9aba866c",
        "symbol": "FluffyCorgi",
        "amount": "4374568406.579430304",
        "usd": 0
      },
      {
        "chainId": 56,
        "token": "0x921d3a6ed8223afb6358410f717e2fb13cbae700",
        "symbol": "QRT",
        "amount": "405706506.073959354",
        "usd": 13.68
      },
      {
        "chainId": 56,
        "token": "0xc18083cc09da5fb3e29ae39e186a817efce6cb3f",
        "symbol": "VIVA",
        "amount": "812241847321.875681431",
        "usd": 1.2
      },
      {
        "chainId": 137,
        "token": "0x46d502fac9aea7c5bc7b13c8ec9d02378c33d36f",
        "symbol": "WSPP",
        "amount": "230489164.364138020108729277",
        "usd": 1.69
      }
    ]
  },
  "refs": [
    "https://github.com/SunWeb3Sec/DeFiHackLabs/blob/ad353ba25fbb897c56d64c28ce92ee10ac68cad2/src/test/2025-06/BankrollStackPlus_exp.sol",
    "https://github.com/SunWeb3Sec/DeFiHackLabs/blob/ad353ba25fbb897c56d64c28ce92ee10ac68cad2/src/test/2025-06/BankrollStack_exp.sol",
    "https://github.com/SunWeb3Sec/DeFiHackLabs/blob/b3719ce7fb93ee6f743853ede9471e1a8bed1de0/src/test/2025-06/BankrollNetwork_exp.sol",
    "https://x.com/Phalcon_xyz/status/1943518566831296566"
  ],
  "notes": [
    "One defect in one template: the campaign hit Bankroll's own Stack deployments on Ethereum and BSC and verbatim forks with the same distribute() and buy order (DrippingFinance, Sinstake, ABS, StakingNetwork, QRT and VIVA pools on BSC, WSPP on Polygon). The Gangsterfinance TokenVault, rewritten code exploited separately, and the 2024 Bankroll buyFor-beneficiary record are other incidents.",
    "The anchor also used buyFor(), which pulls from any approving address, to move 818.9 LINK from six wallets into the pool before withdrawing; their LINK left them and counts as victim depletion, as do the six forced buys in 0x5382925a.",
    "Campaign: every transaction on Ethereum, BSC, Polygon, Avalanche, Arbitrum and Base whose logs show onTokenPurchase, onTokenSell and onWithdraw for one customer on one contract, with a net outflow from it; none precedes the anchor except the 2024 buyFor exploits. Left out: owner pause/reinvest cycle 0x3628d51c and six zero-outflow 0x313e71df transactions.",
    "Drip, ZOMBIE, ABS, SIN, QRT, VIVA and WSPP have no price and are valued at the BNB or POL the attackers got for them; the FluffyCorgi was never sold."
  ]
}
