{
  "$schema": "../../schema/incident.schema.json",
  "protocol": "Hopelend",
  "name": "HopeLend empty-market liquidity index inflation",
  "summary": "The HopeLend pool is an Aave v3 fork whose liquidity index is computed from the reserve balance without a floor on an empty market. With one wei of hEthWBTC supply outstanding the attacker donated WBTC straight to the hEthWBTC reserve, inflating the index so that the rounding on burn returned far more underlying than had been supplied, and used the resulting collateral to borrow the WETH, USDT and USDC markets out.",
  "targets": [
    {
      "address": "0x53fbcada1201a465740f2d64ecdf6fac425f9030",
      "code": "0x3a6d9bf8286a4ada77c15ecf82d4c0c0af95be74",
      "reset": {
        "kind": "deployment",
        "tx": "0x79ed6539033537d054fd7977d00e21918495f22ccaae7ca8823541758ff84ee2"
      }
    }
  ],
  "loss": {
    "usd": 835550.6256910105,
    "assets": [
      {
        "token": "0xc02aaa39b223fe8d0a0e5c4f27ead9083c756cc2",
        "symbol": "WETH",
        "amount": "528.004085822170762393",
        "usd": 835550.6256910105
      }
    ]
  },
  "refs": [
    "https://github.com/SunWeb3Sec/DeFiHackLabs/blob/b3719ce7fb93ee6f743853ede9471e1a8bed1de0/src/test/2023-10/Hopelend_exp.sol"
  ],
  "notes": [
    "The pool is an Aave-fork InitializableImmutableAdminUpgradeabilityProxy, which sets its implementation in the constructor and never emits Upgraded; the proxy emitted no Upgraded event at all between its creation block 17861190 and the exploit. Its EIP-1967 implementation slot is zero at block 17861189 and holds 0x3a6d9bf8286a4ada77c15ecf82d4c0c0af95be74 at block 18377041, so the proxy creation is the change that made the exploited implementation active.",
    "Netting the exploit receipt across the attacker EOA and its exploit contract leaves exactly one non-zero position, 528.004085822170762393 WETH; the WBTC donation, the USDT and USDC borrows and the flash-loan legs all net to zero because they were repaid inside the transaction. The variable debt the attacker leaves behind against those markets is not additionally counted, since the WETH figure already measures what left. A large share of this was taken by a MEV bot that front-ran the attacker rather than by the attacker; that is a redistribution among third parties and does not change the amount the protocol lost. Nothing was recovered by HopeLend."
  ]
}
