{
  "$schema": "../../schema/incident.schema.json",
  "protocol": "bEarn",
  "name": "bEarn BUSD/ibBUSD withdrawal-unit mismatch",
  "summary": "The BUSD Alpaca strategy's withdraw(address,uint256) passed a BUSD-denominated request to FairLaunch as an ibBUSD amount. Because each ibBUSD was worth more than one BUSD, repeated deposit/emergencyWithdraw cycles withdrew excess BUSD and compounded the attacker's credit.",
  "targets": [
    {
      "address": "0x21125d94cfe886e7179c8d2fe8c1ea8d57c73e0e",
      "reset": {
        "kind": "deployment",
        "tx": "0xdd4031277401d5eca44cc73e153effaee20a983b5b513cbf517e08cc9a9911db"
      }
    }
  ],
  "loss": {
    "usd": 10859319,
    "assets": [
      {
        "token": "0xe9e7cea3dedca5984780bafc599bd69add087d56",
        "symbol": "BUSD",
        "amount": "10859319",
        "usd": 10859319
      }
    ]
  },
  "refs": [
    "https://github.com/SunWeb3Sec/DeFiHackLabs/blob/ad353ba25fbb897c56d64c28ce92ee10ac68cad2/src/test/2021-05/bEarn_exp.sol",
    "https://bearndao.medium.com/bvaults-busd-alpaca-strategy-exploit-post-mortem-and-bearn-s-compensation-plan-b0b38c3b5540"
  ],
  "notes": [
    "The direct BUSD Alpaca strategy was deployed with the flawed withdrawal-unit handling and its runtime remained byte-identical immediately before the incident.",
    "bEarn reports that 26 attack transactions beginning with the anchored transaction drained 10,859,319 BUSD from the affected single-stake BUSD vault. The campaign-wide amount is valued at stablecoin par; it is not narrowed to the first transaction's proceeds.",
    "The campaign-wide BUSD amount follows bEarn's primary post-mortem rather than a complete structured set of all 26 attack transaction hashes.",
    "The defect-executing target is the direct BUSD Alpaca strategy, not the bVault bank proxy through which users entered and exited the strategy."
  ]
}
