{
  "$schema": "../../schema/incident.schema.json",
  "protocol": "Umbrella Network",
  "name": "Umbrella StakingRewards unchecked withdrawal accounting",
  "summary": "StakingRewards.withdraw() subtracted the caller-supplied amount from total supply and the caller's balance without checked arithmetic (Solidity 0.7), so an unstaked caller could withdraw LP it never staked. Front-running bots, the named attacker and copycats drained the UMB LP pools on BSC and Ethereum.",
  "targets": [
    {
      "address": "0xfaf0f1cfa8e334cc17a07e3e653c2fa0f9bc8940",
      "reset": {
        "kind": "deployment",
        "tx": "0x523bb6f8a6fbf09c2bd7fa7136b8d20c51b9eb094c934ae71ef735a2938607ca"
      }
    }
  ],
  "campaign": [
    "eip155:56:0xbffcd5a2a16879354b601710681a731ae0060150f308f83a65bc900bcca7e07f",
    "eip155:56:0x9aaf9d778d43547def2e80765711203ebe88663256cca20f37daade4d5f40108",
    "eip155:56:0x05afe00fc33b5bb5615f92f882d23bc9b01b7c8bbf9dc6a258842e1e560c5b2e",
    "eip155:56:0x8aa37a7ac8c3ea31d0a94fb28e84b5a802dadc6c6cd3539d90102c457a3a923c",
    "eip155:56:0xc368a8521d8b9d4b640953bb57d295419c82ed0557179a1443498a06cbb20e4a",
    "eip155:56:0x7278117f68919ed944449caf96a4784094d7360820c6900201e1e84d4e0e7fd5",
    "eip155:56:0x306641cee9570abe1527d00e2295a62d9372078c8588c3b530358a26c0ea71be",
    "eip155:56:0x784b68dc7d06ee181f3127d5eb5331850b5e690cc63dd099cd7b8dc863204bf6",
    "eip155:1:0x33479bcfbc792aa0f8103ab0d7a3784788b5b0e1467c81ffbed1b7682660b4fa",
    "eip155:56:0x66af414c0923ad2d8edbb40339f0a39888ab59815fc376105fa875aa20ee45a0",
    "eip155:56:0x5d37f6e805266d1f63de9f933bb489c02ea2c18a1aeb6e1c09f5a4dd08e58e3b",
    "eip155:1:0x366ca58ecad1940b4aa69ef22e1536e69c1a785c528b8193d5759d5a3c755f97"
  ],
  "loss": {
    "usd": 684977.25,
    "assets": [
      {
        "token": "0xffd8eefb9f0ba3c60282fd3e6567a2c78c994266",
        "symbol": "Cake-LP",
        "amount": "8728.318252191440768451",
        "usd": 133526.74
      },
      {
        "chainId": 1,
        "token": "0xb1bbeea2da2905e6b0a30203aef55c399c53d042",
        "symbol": "UNI-V2",
        "amount": "9011.050646210738527702",
        "usd": 551450.51
      }
    ]
  },
  "refs": [
    "https://github.com/SunWeb3Sec/DeFiHackLabs/blob/b3719ce7fb93ee6f743853ede9471e1a8bed1de0/src/test/2022-03/Umbrella_exp.sol",
    "https://medium.com/umbrella-network/update-on-polar-stream-exploit-b2f4526327f2"
  ],
  "notes": [
    "The BSC UMB/BNB pool ran the same StakingRewards code as Ethereum. Its first withdrawal by an address with no stake is 0x267a5d2a, a bot that copied and front-ran a staker's own withdrawal 0x4d113df4 in block 16201197, ~13.5 h before the Ethereum drain, so it is the anchor.",
    "LP is valued at its redeemable pool share at block-1: 2 x share x WBNB (or WETH) reserve x DefiLlama price. The campaign excludes withdrawals within the caller's own stake (0x4d113df4, 0x1ce9aa93, 0xd3f58d40); copycats 0x66af414c and 0x5d37f6e8 back-ran fresh user stakes."
  ]
}
