{
  "$schema": "../../schema/incident.schema.json",
  "protocol": "Velocore",
  "name": "Velocore ConstantProductPool fee underflow",
  "summary": "ConstantProductPool.velocore__execute() lacked the vault-only authorization required for its state-changing accounting. The attacker called it directly three times with extreme signed amounts to corrupt feeMultiplier; subsequent Vault.execute() calls reached unchecked effective-fee arithmetic that underflowed and returned invalid pool deltas, draining seven pools in the selected transaction.",
  "targets": [
    {
      "address": "0xe2c67a9b15e9e7ff8a9cb0dfb8fee5609923e5db",
      "reset": {
        "kind": "deployment",
        "tx": "0x8cf7767670daea64b5f93692f396af008001e26ecab1ce597d72dbfcda4e440c"
      }
    },
    {
      "address": "0x820aaff56fa2f6ea552e86b7c2da541d67195d07",
      "reset": {
        "kind": "deployment",
        "tx": "0x1a9018ea8d3be4945a7c5df353406e574ea7f8d1e9e9aabef8a29a13b72c2b86"
      }
    },
    {
      "address": "0x1d12e25e5516e5ad32f97fe9edc332bf4683f487",
      "reset": {
        "kind": "deployment",
        "tx": "0x320385029bc9a6a3e16cd78c445d5d5e15c8c65476feca400ffe8303dd43cc88"
      }
    },
    {
      "address": "0xd0e67ce5e72beba9d0986479ea4e4021120cf794",
      "reset": {
        "kind": "deployment",
        "tx": "0x1c5d4f42dc2351c03f249cece73c978e4cffed11e548f8bdd03bed0bcc390624"
      }
    },
    {
      "address": "0xf3e3ec2861850dfa6ba3f52a271f499afffb8087",
      "reset": {
        "kind": "deployment",
        "tx": "0x53955a6fcf11c63ad64e90a23d679e3a30639732bf9b56aad2acfc1334faf9ad"
      }
    },
    {
      "address": "0x99ee7251a051e5265c55a7bf9ffdf58d0fcacc2d",
      "reset": {
        "kind": "deployment",
        "tx": "0xe3bbf494ec94dd8f7301ce802723c64175c7d32f509d6332f24a2d39d5d09586"
      }
    },
    {
      "address": "0xbd4b27dd15bc467d5285c0d7435663935b4b6f7f",
      "reset": {
        "kind": "deployment",
        "tx": "0xa3c7b336f7b9a34c0a51747a5d72ab982703046ecc3cab4af9234d4b789ebc97"
      }
    }
  ],
  "loss": {
    "usd": 6800000,
    "assets": [
      {
        "token": "0x176211869ca2b568f2a7d4ee941e073a821ee1ff",
        "symbol": "USDC",
        "amount": "632705.032352",
        "usd": 632705.032352
      }
    ]
  },
  "refs": [
    "https://x.com/BeosinAlert/status/1797247874528645333",
    "https://github.com/SunWeb3Sec/DeFiHackLabs/blob/b3719ce7fb93ee6f743853ede9471e1a8bed1de0/src/test/2024-06/Velocore_exp.sol",
    "https://blog.verichains.io/p/velocores-incident-analysis",
    "https://medium.com/zokyo-io/postmortem-velocore-90cc92996aad"
  ],
  "notes": [
    "The directly deployed ConstantProductPool retained the same 17,153-byte runtime through the exploit.",
    "Verichains and Zokyo report approximately $6.8 million lost across the coherent Velocore campaign on Linea and zkSync. The selected Linea transaction drains seven pools and directly records, among the multi-asset proceeds, 632,705.032352 USDC transferred from the Velocore Vault to the attack contract. The reported cross-chain total is retained without pretending that this one stablecoin component represents the campaign loss.",
    "The $6.8 million gross loss is a rounded reported campaign estimate across Linea and zkSync; the selected Linea transaction's multi-asset proceeds were checked onchain, but the record does not assign incident-time USD prices to every token component.",
    "Not the knot: sibling instance of the same template and failure; target-6 carries the latest age reset and supplies the incident's single observation."
  ]
}
