{
  "$schema": "../../schema/incident.schema.json",
  "protocol": "SubQuery Network",
  "name": "SubQuery Settings missing setter authorization",
  "summary": "SubQuery's Settings registry let anyone call setContractAddress() and setBatchAddress(). Attackers temporarily pointed roles such as StateChannel or the staking and rewards managers at their own contracts, called the privileged functions that trust those entries to pull SQT from the Treasury, Staking, RewardsDistributor and approving wallets, then restored the registry.",
  "targets": [
    {
      "address": "0x1d1e8c85a2c99575fcb95903c9ad9ae2adea54fc",
      "code": "0xf282737992da4217bf5f8b6ae621181e84d7d3b9",
      "reset": {
        "kind": "upgrade",
        "tx": "0x3a92b06ede91f5855d85d310c89e639c72d7c92f7dcad8f8ee8fe7742cb22488"
      }
    },
    {
      "address": "0x858c50c3af1913b0e849afdb74617388a1a5340d",
      "reset": {
        "kind": "config",
        "tx": "0xaf9af732255b61dabe02ffe9f68a04502291b093178dbf3979975a9e185a9543",
        "address": "0x858c50c3af1913b0e849afdb74617388a1a5340d",
        "call": "0xdd62ed3e000000000000000000000000d043807a0f41ee95fd66a523a93016a53456e79b0000000000000000000000007f138d57a5e05b6fbf3bcadda9a1252354245464"
      }
    }
  ],
  "loss": {
    "usd": 84355.05,
    "assets": [
      {
        "token": "0x858c50c3af1913b0e849afdb74617388a1a5340d",
        "symbol": "SQT",
        "amount": "392393102.928591",
        "usd": 84355.05
      }
    ]
  },
  "campaign": [
    "eip155:8453:0x3e60df144aed640420be974352691308b1c0562f52a48d53e55ef8b19e16845c",
    "eip155:8453:0xaa0fd94041426fe277c54bfcfc100a1ec26f6a7100b860e82a2672f4d013be82",
    "eip155:8453:0x7b6d7850466a985cec6618c95046b9c08c77891d901a28e549a2741b05945a72",
    "eip155:8453:0xd063b3848a6b8c67f46990ab166665d454147855819acb60c083c0aea0180b2d",
    "eip155:8453:0x5a391e858a879a2388c8b5543fddca5b683aae98051365f9af675b8fde6dead0",
    "eip155:8453:0xac3880306a38f23c127a2deb0c75a1f0d45785c457a666f02446a8ade0d3f4f4",
    "eip155:8453:0x824204f7227d7e84d4507bdb96812c8f771726238af6a6bba5be1f15098c4d64",
    "eip155:8453:0x724fa86439bcd2c732a2ed0ab3746be12dded7d499866352772601653fc5a903",
    "eip155:8453:0xb460053f932d119d42ff1b62588bd9a434ab7588d347037595574eb36da00671",
    "eip155:8453:0xf23efa0fab0f6b8c0790d48c6a07abc472ceb32fb3c1b4618b967c09c15a07bf"
  ],
  "refs": [
    "https://subquery.ghost.io/subquery-network-security-incident-report/",
    "https://github.com/SunWeb3Sec/DeFiHackLabs/blob/b3719ce7fb93ee6f743853ede9471e1a8bed1de0/src/test/2026-04/SubQuerySettings_exp.sol"
  ],
  "notes": [
    "Anchor is 0x8bc65598, three days before 0x7b6d7850 and from the same EOA, draining 1.07M SQT from the Treasury through a spoofed StateChannel. A trace_filter sweep of calls into Settings from the anchor to the fix upgrade finds exactly the ten campaign txs.",
    "Second target: the anchor's Treasury pull needs the Treasury Safe's unlimited SQT allowance to RewardsBooster, granted at block 11149644, after the Settings deployment (rule 10 custody grant); it sets the age.",
    "Loss is valued at what attackers realised (rule 15): the dumps moved SQT from about $0.0006 to $0.00014. Sales returned 55,932.47 USDC and 9.912 ETH ($2,212.61); 21.83M SQT left unsold or returned (16.83M sent back to Staking and SubQuery's deployer) is marked at $0.000297."
  ]
}
