{
  "$schema": "../../schema/incident.schema.json",
  "protocol": "Ambient Finance",
  "name": "Ambient CrocSwapDex surplus-collateral accounting",
  "summary": "Flash-loaned WETH deposited as CrocSwapDex native surplus collateral, then a tick-by-tick walk of the ETH/USDC curve with a narrow mint-and-harvest let the attacker disburse more surplus than was deposited, exposing a surplus-collateral accounting flaw in the dex.",
  "targets": [
    {
      "address": "0xaaaaaaaaa24eeeb8d57d431224f73832bc34f688",
      "code": "0xa9dd587ad17aed82cac5596b16dcc9defec885cb",
      "reset": {
        "kind": "upgrade",
        "tx": "0x8619bd3a1cce5c3a0a16288d0ebece5ad07cd1b7d6308a9ffe00dce77328f2b3"
      }
    }
  ],
  "loss": {
    "usd": 110844.04423579527,
    "assets": [
      {
        "token": "0xc02aaa39b223fe8d0a0e5c4f27ead9083c756cc2",
        "symbol": "WETH",
        "amount": "33.721988711712491517",
        "usd": 54930.23601279526
      },
      {
        "token": "0xa0b86991c6218b36c1d19d4a2e9eb0ce3606eb48",
        "symbol": "USDC",
        "amount": "55913.808223",
        "usd": 55913.808223
      }
    ]
  },
  "refs": [
    "https://x.com/TenArmorAlert/status/2063816231023427861",
    "https://github.com/SunWeb3Sec/DeFiHackLabs/blob/b3719ce7fb93ee6f743853ede9471e1a8bed1de0/src/test/2026-06/AmbientCrocSwapDex_exp.sol"
  ],
  "notes": [
    "The final pre-incident callpath-1 sidecar-install event selected WarmPath 0xa9dd587ad17aed82cac5596b16dcc9defec885cb; event data identifies callpath 1.",
    "After the 50 WETH Balancer flash loan was repaid, the receipt records 33.721988711712491517 WETH and 55,913.808223 USDC leaving the attack helper as proceeds. The downstream USDC-to-WETH conversion and builder payments are excluded to avoid double counting."
  ]
}
