{
  "$schema": "../../schema/incident.schema.json",
  "protocol": "Kolan",
  "name": "KolanHook settles expired buy windows at the pool's manipulated spot price",
  "summary": "KolanHook, a Uniswap v4 hook owning the ETH/KLN pool, lets anyone settle an expired buy window with accept(id), which reads the pool's live slot0 price and, when the price is out of range, re-adds the escrowed ETH as liquidity at that price and buys back without a price limit. With flash-borrowed WETH the attacker pushed the price, accepted two expired windows, and swapped its KLN back through the misplaced ETH.",
  "targets": [
    {
      "address": "0x0136fecf49e0217bfd2d9551e8e7b05f174ba8ec",
      "reset": {
        "kind": "deployment",
        "tx": "0x97e3c79293949bbd0e7cd02c5417cf5b023883af3d2a077f15ab7b9866ae282b"
      }
    }
  ],
  "loss": {
    "usd": 3020.52,
    "assets": [
      {
        "symbol": "ETH",
        "amount": "1.279914429958618589",
        "usd": 3020.52
      }
    ]
  },
  "refs": [
    "https://github.com/SunWeb3Sec/DeFiHackLabs/blob/56adc62f45a4774c4d584014b3e5284b0f4d5742/src/test/2026-10/KolanHook_exp.sol"
  ],
  "notes": [
    "The hook is immutable; its later storage writes are users' windows. The seven earlier accept calls were window owners settling their own windows.",
    "Loss is the ETH the hook and its pool position lost net, which equals the attacker's gain; the window owners received KLN as the windows specify."
  ]
}
