{
  "$schema": "../../schema/incident.schema.json",
  "protocol": "NFTG",
  "name": "NFTG presale unprotected setMainContract",
  "summary": "The NFTG presale's setMainContract(address), which sets the token PresaleWithUSDT pays buyers in, had no access control. A fresh contract set it to USDT; in the next transaction the attacker bought eleven times for 76.5 USDT each with a flash loan and was paid about 989.6 USDT per purchase, a token amount priced for NFTG, draining the presale's 10,044 USDT. The main contract was set back to NFTG 202 blocks later.",
  "targets": [
    {
      "address": "0x5fbbb391d54f4fb1d1cf18310c93d400bc80042e",
      "reset": {
        "kind": "deployment",
        "tx": "0xb0781f78b2ff1ee4edeb6f2e5804ba974dd988bacd9f49a58339a14afb54c72f"
      }
    }
  ],
  "loss": {
    "usd": 10031.77,
    "assets": [
      {
        "token": "0x55d398326f99059ff775485246999027b3197955",
        "symbol": "USDT",
        "amount": "10044.490614704315622688",
        "usd": 10031.77
      }
    ]
  },
  "campaign": [
    "eip155:56:0xbd330fd17d0f825042474843a223547132a49abb0746a7e762a0b15cf4bd28f6"
  ],
  "refs": [
    "https://github.com/SunWeb3Sec/DeFiHackLabs/blob/ad353ba25fbb897c56d64c28ce92ee10ac68cad2/src/test/2024-11/NFTG_exp.sol",
    "https://x.com/TenArmorAlert/status/1861430745572745245",
    "eip155:56:0x338c9ec83a39fbb04ce5e3f4611f9fe4429357904bc1b78b81afef8b1e807218"
  ],
  "notes": [
    "Anchor: 0xf5ce6f26's call through its contract 0x43fb0c58 setting the main contract to USDT (selector 0x3ded33bc, setMainContract(address)), the setup the drain 0xbd330fd1 by 0x5af00b07 needed; the same EOA restored NFTG in 0x338c9ec8. Neither is the owner 0x76ebdad3; eth_calls of setMainContract from arbitrary addresses succeed at blocks 40000000 and 44348345. The contract is unverified; forked replays show PresaleWithUSDT paying NFTG at block 44348340 and USDT from block 44348360.",
    "Loss: the presale's net USDT outflow in the drain, equal to the attacker's profit; no other PresaleWithUSDT call fell between the two setMainContract calls."
  ]
}