{
  "$schema": "../../schema/incident.schema.json",
  "protocol": "MARA (0xc6a8)",
  "name": "MARA proxy unauthenticated swap entry point",
  "summary": "The MARA proxy exposes an unauthenticated payable entry point (selector 0x5fc985ea) that runs caller-supplied swap paths with the contract's own funds, letting the attacker skew the MARA pair inside a DODO flash loan and sell into it.",
  "targets": [
    {
      "address": "0xc6a8c02dd5a3dd1616ec072bfc7c9d3df9682a63",
      "code": "0xa3f6af29001874ed06c1bf41427e33256b1d97d4",
      "reset": {
        "kind": "upgrade",
        "tx": "0xb1ecf5569d739d5aebfba26b53d00edd95004f22bc7f1fa597fbcd7c96adc46b"
      }
    }
  ],
  "loss": {
    "usd": 5338.113631974839,
    "assets": [
      {
        "token": "0xbb4cdb9cbd36b01bd1cbaebf2de08d9173bc095c",
        "symbol": "WBNB",
        "amount": "8.8",
        "usd": 5338.113631974839
      }
    ]
  },
  "refs": [
    "https://github.com/SunWeb3Sec/DeFiHackLabs/blob/b3719ce7fb93ee6f743853ede9471e1a8bed1de0/src/test/2024-09/MARA_exp.sol"
  ],
  "notes": [
    "Fourth and final Upgraded event before the exploit; it selected the implementation executed during the exploit.",
    "The exploit receipt records exactly 8.8 WBNB transferred to the attacker EOA after the 11 WBNB DODO flash loan was repaid."
  ]
}
