{
  "$schema": "../../schema/incident.schema.json",
  "protocol": "DIP",
  "name": "DIP double router transfer",
  "summary": "DIP._transfer executes the base transfer twice when either endpoint is the router. Skimming excess DIP to the router debited the pair twice; sync committed the reduced reserve, allowing the attacker to exchange remaining DIP for almost all AIC.",
  "targets": [
    {
      "address": "0x6c60bf5db0670ae94489d3dde2c60f271625db50",
      "reset": {
        "kind": "deployment",
        "tx": "0x9502969628b8ce0c25caf1f98542d89a040ee558f80a181e6f6f8c21ee42116e"
      }
    }
  ],
  "loss": {
    "usd": 111765.674801107,
    "assets": [
      {
        "token": "0x524c72268e2053bb356ecb4c1364b5bb74644405",
        "symbol": "AIC",
        "amount": "10037659.001700876485419035",
        "usd": 111765.674801107
      }
    ]
  },
  "refs": [
    "https://github.com/SunWeb3Sec/DeFiHackLabs/blob/ad353ba25fbb897c56d64c28ce92ee10ac68cad2/src/test/2026-06/DIP_exp.sol",
    "eip155:56:0x3f89a62ddd8fef802797bf0d1dc095a1f3248c750df518ea02b62d087c29570c",
    "eip155:56:0x4da2a57318c77bfa5d8daf16e996c271a925abd583450ee861c57d3ba900bf70",
    "eip155:56:0xcef3011fb9b95520b707ac712117c390c0de87a8930b1dab3299cbb67f686214",
    "eip155:56:0x167453a31e46ee233d4a21b5c3d05728f8967d794d0dbc2bdb6c20327c667fd7"
  ],
  "notes": [
    "Exact AIC depletion of pair 0xf7d8267d01d1104da2dd30828aa9c0e1647919ef excludes the attacker-supplied 19000000 AIC swap input. Valuation applies the same-transaction realised price: 9977659.001700876485419035 AIC sold for 111097.596667856001191208 USDC, valued at par. The remaining 60000 AIC paid as financing cost stays in gross loss and is estimated at that effective price. DIP shifted to the router is not valued separately; gas and financing do not reduce gross loss."
  ]
}
