{
  "$schema": "../../schema/incident.schema.json",
  "protocol": "NewMarketTrading",
  "name": "NewMarketTrading SquidRouterModule unbound delegate",
  "summary": "SquidRouterModule accepted Axelar express execution while treating caller-supplied sourceAddress and delegate values as authority and never binding the delegate to msg.sender. Forged payloads therefore drove victim Safes to approve and swap valuable assets into attacker pools.",
  "targets": [
    {
      "address": "0x1f1d37a3bf840e35c6a860c7c2da71fe555123ca",
      "reset": {
        "kind": "deployment",
        "tx": "0x35eba2583c94301e1aef89867d9ec438d9a3378875dc7be6b3cf02799d65f693"
      }
    }
  ],
  "loss": {
    "usd": 3980000,
    "assets": []
  },
  "refs": [
    "https://github.com/SunWeb3Sec/DeFiHackLabs/blob/ad353ba25fbb897c56d64c28ce92ee10ac68cad2/src/test/2026-05/NewMarketTrading_exp.sol",
    "https://rekt.news/newmarkettrading-rekt",
    "https://github.com/sanbir/evm-hack-registry/blob/d6c70c964a670c7ac83c24b3ca91bd862b1bf9d6/2026-05-NewMarketTrading_exp/sources/SquidRouterModule_1f1d37/contracts_modules_SquidRouterModule.sol"
  ],
  "notes": [
    "The directly executed Base module was deployed with immutable integration addresses. Its runtime contains no delegation or destruction path and remained unchanged through the campaign's first successful drain.",
    "Rekt reports a $3.98 million gross campaign across 308 successful drain transactions affecting 88 Safes on Base, Arbitrum, and Ethereum. NMT offered a white-hat bounty, but the cited reporting records no returned proceeds; recovery is not netted.",
    "Published campaign estimates range from $3.78 million to $3.98 million because two drained assets lacked contemporaneous price feeds; this record uses Rekt's reported $3.98 million aggregate."
  ]
}
