{
  "$schema": "../../schema/incident.schema.json",
  "protocol": "UPS",
  "name": "UPS transfers to its pair leave the pair's recorded balance unchanged",
  "summary": "UPS's _transfer does not credit the UPS/USDT pair's balance when tokens are sent to it, so swaps, skims and syncs could repeatedly pull UPS and then USDT from the pair; the attacker did so six hours after deployment.",
  "targets": [
    {
      "address": "0x3da4828640ad831f3301a4597821cc3461b06678",
      "reset": {
        "kind": "deployment",
        "tx": "0x41d101d7a1f48588c4d86cff6a8b4c78037570da07fc6a8f169480d5100db0d5"
      }
    }
  ],
  "loss": {
    "usd": 30308.12,
    "assets": [
      {
        "token": "0x55d398326f99059ff775485246999027b3197955",
        "symbol": "USDT",
        "amount": "30277.843051551135057044",
        "usd": 30308.12
      }
    ]
  },
  "refs": [
    "https://app.blocksec.com/explorer/tx/bsc/0xd03702e17171a32464ce748b8797008d59e2dbcecd3b3847d5138414566c886d",
    "https://github.com/SunWeb3Sec/DeFiHackLabs/blob/b3719ce7fb93ee6f743853ede9471e1a8bed1de0/src/test/2024-04/UPS_exp.sol"
  ],
  "notes": [
    "The owner's fee setting after deployment is not a reset. Loss is the pair's USDT; its UPS is valued at nothing (rule 12)."
  ]
}
