{
  "$schema": "../../schema/incident.schema.json",
  "protocol": "Spiral",
  "name": "SpiralHookV2 spot-price borrow with tx.origin same-block guard",
  "summary": "SpiralHookV2.borrow values SPIRAL collateral at the live slot0 price of its own Uniswap V4 pool, and its only same-block defence keys lastSwapBlockOf on tx.origin. The attacker pumped the pool from one EOA, then borrowed hook-owned ETH against the bought SPIRAL at the inflated spot from six other EOAs through one contract in the same block.",
  "targets": [
    {
      "address": "0x1725577dc9b1ee2d95db49c2193226471594aacc",
      "reset": {
        "kind": "deployment",
        "tx": "0x8af8f4533d8eb3e54a67b37e2edc9dc4eab3161c228c0e2920c73b883ae1ed04"
      }
    }
  ],
  "campaign": [
    "eip155:1:0x3172b1d4baf8d29cb2ecd74e3eb89c34d786290ce9f607a3c4edc136281d6fb2",
    "eip155:1:0x09524ce13bf47d103fabf69a8e260fe19b0c6699a4b01858ee56ea1ebed19cfc",
    "eip155:1:0x129f6c6894832b2d1ccbfd392fd5004da720ed35c5ef2e9ef1687ceea6b8f22b",
    "eip155:1:0xc197577734d690d0335d7e315dfaf99ff153055a1854ed5cf5033d4dbf8653d5",
    "eip155:1:0x0dd9a193c77e9fab48157a02ed123f08ead7fcf31cd2f6fa7be69e28e2890db1"
  ],
  "loss": {
    "usd": 29689.15,
    "assets": [
      {
        "symbol": "ETH",
        "amount": "11.78728098661343541",
        "usd": 29689.15
      }
    ]
  },
  "refs": [
    "https://github.com/SunWeb3Sec/DeFiHackLabs/blob/8d8c5db24bf7a74af3d9a4c1f8e1452cd839e8b1/src/test/2026-09/SpiralHookV2_exp.sol",
    "eip155:1:0x84f2f1d061b187d3c2096281b8a52805185604468e4f005580a9150d36379925"
  ],
  "notes": [
    "Owner launch steps after deployment (initializePool, seedBands, openTrading) only bind the hook to its own pool and open trading; the spot-price valuation and tx.origin guard are immutable code, so deployment is the reset.",
    "The six borrows paid the attacker 64.707 ETH net of origination fees to the protocol's buyback. The 52.92 ETH its pump put into the pool is a round trip of its own funds and is offset; the 1.08 ETH swap fee it paid is a fee and is not. The SPIRAL collateral left behind is not netted."
  ]
}
